{
  "schemaVersion": 1,
  "proposalID": "44444444-4444-4444-8444-444444444444",
  "projectID": "11111111-1111-4111-8111-111111111111",
  "status": "proposed",
  "inputSnapshotSHA256": "464997dd2ba73cc5d14faad51ba6c07700aa8a313a24193992a3eab542764b11",
  "modelRoute": {
    "routeKind": "exampleOnly",
    "providerID": "example-provider",
    "modelID": "example-model"
  },
  "rationale": "Fixture only: demonstrate a reviewed replacement guarded by the existing file hash.",
  "changes": [
    {
      "operation": "replace",
      "targetKind": "memoryPage",
      "relativePath": "wiki/project-conventions.md",
      "baseSHA256": "4f28bfb996c5355bb2fee744472e851724ba91e61a2a67a4df6c4cc6580405de",
      "proposedContent": "---\nschema_version: 1\nid: \"33333333-3333-4333-8333-333333333333\"\ntitle: \"Example project conventions\"\nproject_id: \"11111111-1111-4111-8111-111111111111\"\nkind: \"constraint\"\nreview_status: \"approved\"\nrevision: 2\nreviewed_at: \"2026-09-07T00:00:00Z\"\nreviewer: \"fixture-only-not-a-real-user-review\"\nexample_only: true\nsources:\n  - \"example-source-001\"\n---\n\n# Example project conventions\n\nThis is fixture content, not an actual approved decision.\n\nThe example project keeps terminal rendering separate from its memory index.\n\nExample addition: index work must not block terminal input.\n",
      "sourceIDs": [
        "example-source-001"
      ]
    }
  ]
}
